{
  "$id": "https://posthog-impact.local/schemas/references.schema.json",
  "$schema": "https://json-schema.org/draft/2020-12/schema",
  "additionalProperties": false,
  "properties": {
    "computed_at": {
      "arrow_type": "string",
      "type": [
        "string",
        "null"
      ]
    },
    "evidence": {
      "arrow_type": "string",
      "type": [
        "string",
        "null"
      ]
    },
    "reference_kind": {
      "arrow_type": "string",
      "type": [
        "string",
        "null"
      ]
    },
    "reference_subtype": {
      "arrow_type": "string",
      "type": [
        "string",
        "null"
      ]
    },
    "reference_value": {
      "arrow_type": "string",
      "type": [
        "string",
        "null"
      ]
    },
    "source_field": {
      "arrow_type": "string",
      "type": [
        "string",
        "null"
      ]
    },
    "source_id": {
      "arrow_type": "string",
      "type": [
        "string",
        "null"
      ]
    },
    "source_kind": {
      "arrow_type": "string",
      "type": [
        "string",
        "null"
      ]
    },
    "source_number": {
      "arrow_type": "int64",
      "type": [
        "integer",
        "null"
      ]
    },
    "strength": {
      "arrow_type": "string",
      "type": [
        "string",
        "null"
      ]
    }
  },
  "title": "references",
  "type": "object",
  "x-pipeline-version": "1.0.0",
  "x-schema-version": "1.0.0"
}
