[
  {
    "computed_at": "2026-08-17T14:45:38.551393Z",
    "evidence": "CrossReferencedEvent at 2022-12-15T21:33:01Z",
    "reference_kind": "issue_or_pr",
    "reference_subtype": "timeline_CrossReferencedEvent",
    "reference_value": "13363",
    "source_field": "github_timeline",
    "source_id": "github.com/PostHog/posthog#issue/1",
    "source_kind": "issue",
    "source_number": 1,
    "strength": "medium"
  },
  {
    "computed_at": "2026-08-17T14:45:38.551354Z",
    "evidence": "CrossReferencedEvent at 2020-08-06T14:52:24Z",
    "reference_kind": "issue_or_pr",
    "reference_subtype": "timeline_CrossReferencedEvent",
    "reference_value": "1374",
    "source_field": "github_timeline",
    "source_id": "github.com/PostHog/posthog#issue/1",
    "source_kind": "issue",
    "source_number": 1,
    "strength": "medium"
  },
  {
    "computed_at": "2026-08-17T14:45:38.551395Z",
    "evidence": "CrossReferencedEvent at 2023-04-21T09:38:48Z",
    "reference_kind": "issue_or_pr",
    "reference_subtype": "timeline_CrossReferencedEvent",
    "reference_value": "15153",
    "source_field": "github_timeline",
    "source_id": "github.com/PostHog/posthog#issue/1",
    "source_kind": "issue",
    "source_number": 1,
    "strength": "medium"
  },
  {
    "computed_at": "2026-08-17T14:45:38.551362Z",
    "evidence": "CrossReferencedEvent at 2020-08-29T12:01:58Z",
    "reference_kind": "issue_or_pr",
    "reference_subtype": "timeline_CrossReferencedEvent",
    "reference_value": "1529",
    "source_field": "github_timeline",
    "source_id": "github.com/PostHog/posthog#issue/1",
    "source_kind": "issue",
    "source_number": 1,
    "strength": "medium"
  },
  {
    "computed_at": "2026-08-17T14:45:38.551397Z",
    "evidence": "CrossReferencedEvent at 2023-05-17T08:46:32Z",
    "reference_kind": "issue_or_pr",
    "reference_subtype": "timeline_CrossReferencedEvent",
    "reference_value": "15578",
    "source_field": "github_timeline",
    "source_id": "github.com/PostHog/posthog#issue/1",
    "source_kind": "issue",
    "source_number": 1,
    "strength": "medium"
  },
  {
    "computed_at": "2026-08-17T14:45:38.551351Z",
    "evidence": "CrossReferencedEvent at 2020-02-22T01:17:23Z",
    "reference_kind": "issue_or_pr",
    "reference_subtype": "timeline_CrossReferencedEvent",
    "reference_value": "165",
    "source_field": "github_timeline",
    "source_id": "github.com/PostHog/posthog#issue/1",
    "source_kind": "issue",
    "source_number": 1,
    "strength": "medium"
  },
  {
    "computed_at": "2026-08-17T14:45:38.551399Z",
    "evidence": "CrossReferencedEvent at 2023-09-28T17:31:53Z",
    "reference_kind": "issue_or_pr",
    "reference_subtype": "timeline_CrossReferencedEvent",
    "reference_value": "17679",
    "source_field": "github_timeline",
    "source_id": "github.com/PostHog/posthog#issue/1",
    "source_kind": "issue",
    "source_number": 1,
    "strength": "medium"
  },
  {
    "computed_at": "2026-08-17T14:45:38.551400Z",
    "evidence": "CrossReferencedEvent at 2023-10-26T09:32:18Z",
    "reference_kind": "issue_or_pr",
    "reference_subtype": "timeline_CrossReferencedEvent",
    "reference_value": "18089",
    "source_field": "github_timeline",
    "source_id": "github.com/PostHog/posthog#issue/1",
    "source_kind": "issue",
    "source_number": 1,
    "strength": "medium"
  },
  {
    "computed_at": "2026-08-17T14:45:38.551370Z",
    "evidence": "CrossReferencedEvent at 2021-05-11T01:35:37Z",
    "reference_kind": "issue_or_pr",
    "reference_subtype": "timeline_CrossReferencedEvent",
    "reference_value": "4238",
    "source_field": "github_timeline",
    "source_id": "github.com/PostHog/posthog#issue/1",
    "source_kind": "issue",
    "source_number": 1,
    "strength": "medium"
  },
  {
    "computed_at": "2026-08-17T14:45:38.551372Z",
    "evidence": "CrossReferencedEvent at 2021-05-18T17:59:24Z",
    "reference_kind": "issue_or_pr",
    "reference_subtype": "timeline_CrossReferencedEvent",
    "reference_value": "4372",
    "source_field": "github_timeline",
    "source_id": "github.com/PostHog/posthog#issue/1",
    "source_kind": "issue",
    "source_number": 1,
    "strength": "medium"
  },
  {
    "computed_at": "2026-08-17T14:45:38.551375Z",
    "evidence": "CrossReferencedEvent at 2021-05-26T15:25:15Z",
    "reference_kind": "issue_or_pr",
    "reference_subtype": "timeline_CrossReferencedEvent",
    "reference_value": "4505",
    "source_field": "github_timeline",
    "source_id": "github.com/PostHog/posthog#issue/1",
    "source_kind": "issue",
    "source_number": 1,
    "strength": "medium"
  },
  {
    "computed_at": "2026-08-17T14:45:38.551377Z",
    "evidence": "CrossReferencedEvent at 2021-06-01T19:50:46Z",
    "reference_kind": "issue_or_pr",
    "reference_subtype": "timeline_CrossReferencedEvent",
    "reference_value": "4553",
    "source_field": "github_timeline",
    "source_id": "github.com/PostHog/posthog#issue/1",
    "source_kind": "issue",
    "source_number": 1,
    "strength": "medium"
  },
  {
    "computed_at": "2026-08-17T14:45:38.551380Z",
    "evidence": "CrossReferencedEvent at 2021-07-14T11:34:33Z",
    "reference_kind": "issue_or_pr",
    "reference_subtype": "timeline_CrossReferencedEvent",
    "reference_value": "5074",
    "source_field": "github_timeline",
    "source_id": "github.com/PostHog/posthog#issue/1",
    "source_kind": "issue",
    "source_number": 1,
    "strength": "medium"
  },
  {
    "computed_at": "2026-08-17T14:45:38.551378Z",
    "evidence": "CrossReferencedEvent at 2021-07-13T08:14:53Z",
    "reference_kind": "issue_or_pr",
    "reference_subtype": "timeline_CrossReferencedEvent",
    "reference_value": "5088",
    "source_field": "github_timeline",
    "source_id": "github.com/PostHog/posthog#issue/1",
    "source_kind": "issue",
    "source_number": 1,
    "strength": "medium"
  },
  {
    "computed_at": "2026-08-17T14:45:38.551382Z",
    "evidence": "CrossReferencedEvent at 2021-07-14T20:43:59Z",
    "reference_kind": "issue_or_pr",
    "reference_subtype": "timeline_CrossReferencedEvent",
    "reference_value": "5091",
    "source_field": "github_timeline",
    "source_id": "github.com/PostHog/posthog#issue/1",
    "source_kind": "issue",
    "source_number": 1,
    "strength": "medium"
  },
  {
    "computed_at": "2026-08-17T14:45:38.551384Z",
    "evidence": "CrossReferencedEvent at 2021-12-01T12:24:48Z",
    "reference_kind": "issue_or_pr",
    "reference_subtype": "timeline_CrossReferencedEvent",
    "reference_value": "7463",
    "source_field": "github_timeline",
    "source_id": "github.com/PostHog/posthog#issue/1",
    "source_kind": "issue",
    "source_number": 1,
    "strength": "medium"
  },
  {
    "computed_at": "2026-08-17T14:45:38.551388Z",
    "evidence": "CrossReferencedEvent at 2022-01-06T13:35:32Z",
    "reference_kind": "issue_or_pr",
    "reference_subtype": "timeline_CrossReferencedEvent",
    "reference_value": "7766",
    "source_field": "github_timeline",
    "source_id": "github.com/PostHog/posthog#issue/1",
    "source_kind": "issue",
    "source_number": 1,
    "strength": "medium"
  },
  {
    "computed_at": "2026-08-17T14:45:38.551386Z",
    "evidence": "CrossReferencedEvent at 2022-01-05T13:05:31Z",
    "reference_kind": "issue_or_pr",
    "reference_subtype": "timeline_CrossReferencedEvent",
    "reference_value": "7893",
    "source_field": "github_timeline",
    "source_id": "github.com/PostHog/posthog#issue/1",
    "source_kind": "issue",
    "source_number": 1,
    "strength": "medium"
  },
  {
    "computed_at": "2026-08-17T14:45:38.551390Z",
    "evidence": "CrossReferencedEvent at 2022-02-16T11:26:23Z",
    "reference_kind": "issue_or_pr",
    "reference_subtype": "timeline_CrossReferencedEvent",
    "reference_value": "8628",
    "source_field": "github_timeline",
    "source_id": "github.com/PostHog/posthog#issue/1",
    "source_kind": "issue",
    "source_number": 1,
    "strength": "medium"
  },
  {
    "computed_at": "2026-08-17T14:45:38.551391Z",
    "evidence": "CrossReferencedEvent at 2022-03-10T15:24:46Z",
    "reference_kind": "issue_or_pr",
    "reference_subtype": "timeline_CrossReferencedEvent",
    "reference_value": "8962",
    "source_field": "github_timeline",
    "source_id": "github.com/PostHog/posthog#issue/1",
    "source_kind": "issue",
    "source_number": 1,
    "strength": "medium"
  },
  {
    "computed_at": "2026-08-17T14:45:38.551678Z",
    "evidence": "CrossReferencedEvent at 2023-07-12T21:51:29Z",
    "reference_kind": "issue_or_pr",
    "reference_subtype": "timeline_CrossReferencedEvent",
    "reference_value": "16542",
    "source_field": "github_timeline",
    "source_id": "github.com/PostHog/posthog#issue/14579",
    "source_kind": "issue",
    "source_number": 14579,
    "strength": "medium"
  },
  {
    "computed_at": "2026-08-17T14:45:38.551680Z",
    "evidence": "CrossReferencedEvent at 2026-06-10T08:33:12Z",
    "reference_kind": "issue_or_pr",
    "reference_subtype": "timeline_CrossReferencedEvent",
    "reference_value": "62620",
    "source_field": "github_timeline",
    "source_id": "github.com/PostHog/posthog#issue/14579",
    "source_kind": "issue",
    "source_number": 14579,
    "strength": "medium"
  },
  {
    "computed_at": "2026-08-17T14:45:38.551775Z",
    "evidence": "CrossReferencedEvent at 2025-04-07T23:03:03Z",
    "reference_kind": "issue_or_pr",
    "reference_subtype": "timeline_CrossReferencedEvent",
    "reference_value": "30903",
    "source_field": "github_timeline",
    "source_id": "github.com/PostHog/posthog#issue/15480",
    "source_kind": "issue",
    "source_number": 15480,
    "strength": "medium"
  },
  {
    "computed_at": "2026-08-17T14:45:38.551773Z",
    "evidence": "CrossReferencedEvent at 2023-05-20T23:26:07Z",
    "reference_kind": "issue_or_pr",
    "reference_subtype": "timeline_CrossReferencedEvent",
    "reference_value": "6007",
    "source_field": "github_timeline",